{
  "session_id": "22222222-2222-4222-8222-222222222223",
  "org_id": "org_acme001",
  "role_id": "role_retail01",
  "instrument_id": "retail-associate",
  "instrument_version": 1,
  "candidate_ref": "cand_0a1b2c3d4e5f6a7b",
  "language": "es",
  "started_at": "2026-10-06T15:40:00Z",
  "ended_at": "2026-10-06T15:41:35Z",
  "duration_seconds": 95,
  "status": "abandoned",
  "disclosure_receipt_id": "11111111-1111-4111-8111-111111111113",
  "ats": {"system": "none"},
  "recording_retention": {"policy": "customer-default", "deleted_at": null, "deletion_request_id": null}
}
